{ "$schema":"https://json-schema.org/draft/2020-12/schema", "title":"Skill Manifest V9", "type":"object", "required":["name","type","domain","subdomain","version","owner","maturity","dependencies","activation_triggers","required_context","optional_context","input_contract","output_contract","memory_policy","token_budget","context_loading","governance_level","human_approval_required","execution_mode","latency_target","cost_target","determinism_level","telemetry_events","eval_metrics","security_classification","integration_targets","data_contracts","failure_modes","fallbacks"], "properties":{"name":{"type":"string"},"type":{"enum":["core","skill","agent","workflow"]},"domain":{"type":["string","null"]},"subdomain":{"type":["string","null"]},"version":{"type":"string"},"owner":{"type":["string","null"]},"maturity":{"type":["string","null"]},"dependencies":{"type":"array"},"activation_triggers":{"type":"array"},"required_context":{"type":"array"},"optional_context":{"type":"array"},"input_contract":{},"output_contract":{},"memory_policy":{"type":["object","string","null"]},"token_budget":{"type":["object","integer","number","null"]},"context_loading":{"type":["object","string","null"]},"governance_level":{"type":["string","null"]},"human_approval_required":{"type":["boolean","null"]},"execution_mode":{"type":["string","null"]},"latency_target":{"type":["string","number","null"]},"cost_target":{"type":["string","number","null"]},"determinism_level":{"type":["string","null"]},"telemetry_events":{"type":"array"},"eval_metrics":{"type":"array"},"security_classification":{"type":["string","null"]},"integration_targets":{"type":"array"},"data_contracts":{"type":"array"},"failure_modes":{"type":"array"},"fallbacks":{"type":"array"}}}
